{
  "$schema": "http://json-schema.org/draft-07/schema#",
  "type": "object",
  "properties": {
    "$schema": {
      "type": "string"
    },
    "Everything is a plain string": {
      "additionalProperties": false,
      "description": "",
      "properties": {
        "ar": {
          "type": "string"
        },
        "es": {
          "type": "string"
        },
        "zh": {
          "type": "string"
        }
      },
      "type": "object"
    },
    "Guide": {
      "additionalProperties": false,
      "description": "",
      "properties": {
        "ar": {
          "type": "string"
        },
        "es": {
          "type": "string"
        },
        "zh": {
          "type": "string"
        }
      },
      "type": "object"
    },
    "Home": {
      "additionalProperties": false,
      "description": "",
      "properties": {
        "ar": {
          "type": "string"
        },
        "es": {
          "type": "string"
        },
        "zh": {
          "type": "string"
        }
      },
      "type": "object"
    },
    "Rsbuild with Vue": {
      "additionalProperties": false,
      "description": "",
      "properties": {
        "ar": {
          "type": "string"
        },
        "es": {
          "type": "string"
        },
        "zh": {
          "type": "string"
        }
      },
      "type": "object"
    },
    "Start building amazing things with Rsbuild.": {
      "additionalProperties": false,
      "description": "",
      "properties": {
        "ar": {
          "type": "string"
        },
        "es": {
          "type": "string"
        },
        "zh": {
          "type": "string"
        }
      },
      "type": "object"
    },
    "The header above is shared, and anchors itself.": {
      "additionalProperties": false,
      "description": "",
      "properties": {
        "ar": {
          "type": "string"
        },
        "es": {
          "type": "string"
        },
        "zh": {
          "type": "string"
        }
      },
      "type": "object"
    },
    "This document has its own entry, and its own catalog chunk.": {
      "additionalProperties": false,
      "description": "",
      "properties": {
        "ar": {
          "type": "string"
        },
        "es": {
          "type": "string"
        },
        "zh": {
          "type": "string"
        }
      },
      "type": "object"
    },
    "Two documents, two entries, one shared header.": {
      "additionalProperties": false,
      "description": "",
      "properties": {
        "ar": {
          "type": "string"
        },
        "es": {
          "type": "string"
        },
        "zh": {
          "type": "string"
        }
      },
      "type": "object"
    }
  },
  "required": [
    "Everything is a plain string",
    "Guide",
    "Home",
    "Rsbuild with Vue",
    "Start building amazing things with Rsbuild.",
    "The header above is shared, and anchors itself.",
    "This document has its own entry, and its own catalog chunk.",
    "Two documents, two entries, one shared header."
  ],
  "additionalProperties": false
}
